{
  "manifest": {
    "id": "astarions-book-of-hungers",
    "title": "Astarion's Book of Hungers",
    "publisher": "Wizards of the Coast",
    "version": "1.0.0",
    "compatibility": "2024",
    "description": "Character options from Astarion's Book of Hungers: the Dhampir species, 3 backgrounds (Carouser, Vampire Devotee, Vampire Survivor), and 16 vampiric feats.",
    "dependencies": [
      "core-phb-2024"
    ]
  },
  "species": [
    {
      "name": "Dhampir",
      "description": "Dhampirs are living people who possess vampiric prowess but are cursed with macabre hunger. Most dhampirs thirst for blood, but some gain sustenance from dreams, life energy, or other vital sources. Dhampirs must choose whether to fight to control their hunger or give in to predatory urges. Dhampirs often arise from encounters with vampires; some are the descendants of a powerful vampire, while others are partially transformed by a vampire's bite. All manner of macabre bargains and necromantic influences might also give rise to a dhampir. Regardless of their origins, dhampirs exhibit their vampiric nature in various ways, including increased speed and a life-draining bite.",
      "creature_type": "Humanoid",
      "size": "Medium or Small",
      "size_description": "Medium (about 4\u20137 feet tall) or Small (about 2\u20134 feet tall), chosen when you select this species",
      "speed": 35,
      "darkvision": 60,
      "languages": [
        "Common"
      ],
      "source": "Astarion's Book of Hungers",
      "traits": {
        "Darkvision": {
          "description": "You have Darkvision with a range of 60 feet.",
          "effects": [
            {
              "type": "grant_darkvision",
              "range": 60
            }
          ]
        },
        "Spider Climb": {
          "description": "You have a Climb Speed equal to your Speed. When you reach character level 3, you can move up, down, and across vertical surfaces and along ceilings while leaving your hands free."
        },
        "Trace of Undeath": {
          "description": "You have Resistance to Necrotic damage.",
          "effects": [
            {
              "type": "grant_damage_resistance",
              "damage_type": "Necrotic"
            }
          ]
        },
        "Vampiric Bite": {
          "description": "When you use your Unarmed Strike and deal damage, you can choose to bite with your fangs. You deal Piercing damage equal to 1d4 plus your Constitution modifier instead of the normal damage of an Unarmed Strike. In addition, when you deal this damage to a creature that isn't a Construct or an Undead, you can empower yourself in one of the following ways:\n- Drain. You regain Hit Points equal to the Piercing damage dealt.\n- Strengthen. You gain a bonus to the next ability check or attack roll you make within the next minute; the bonus is equal to the Piercing damage dealt.\nYou can empower yourself with this trait a number of times equal to your Proficiency Bonus, and you regain all expended uses when you finish a Long Rest."
        }
      }
    }
  ],
  "backgrounds": [
    {
      "name": "Carouser",
      "description": "You grew to adulthood in the beating heart of a large city, such as Baldur's Gate. You spent countless evenings in taverns, playhouses, parlors, and gambling dens, savoring all the city had to offer. You're a natural at interacting with people to learn their secrets, whether over a high-stakes game or at a high-class soiree. You might have been thrown out of an establishment or ten, but only by people who don't know how to party.",
      "edition": "2024",
      "status": "active",
      "source": "Astarion's Book of Hungers",
      "ability_score_increase": {
        "total": 3,
        "options": [
          "Dexterity",
          "Intelligence",
          "Charisma"
        ],
        "suggested": {
          "Charisma": 2,
          "Dexterity": 1
        }
      },
      "effects": [
        {
          "type": "grant_skill_proficiency",
          "skills": [
            "Deception",
            "Persuasion"
          ]
        },
        {
          "type": "grant_origin_feat",
          "feat": "Tireless Reveler"
        },
        {
          "type": "grant_tool_proficiency",
          "tools": [
            "Gaming Set"
          ]
        }
      ],
      "starting_equipment": {
        "option_a": {
          "items": [
            "Dagger",
            "Gaming Set",
            "Fine Clothes",
            "Glass Bottle",
            "Mirror",
            "Perfume",
            "Pouch",
            "Tinderbox"
          ],
          "gold": 19
        },
        "option_b": {
          "gold": 50
        }
      }
    },
    {
      "name": "Vampire Devotee",
      "description": "You were in service to a vampire or a small group of vampires lairing together. The Undead drank your blood more times than you can count. You might have served willingly, perhaps with aspirations of one day becoming a vampire yourself. Or you might have been magically charmed and retain only a few muddled memories of your time as a vampire familiar. In either case, your time in the vampire den is over.",
      "edition": "2024",
      "status": "active",
      "source": "Astarion's Book of Hungers",
      "ability_score_increase": {
        "total": 3,
        "options": [
          "Strength",
          "Constitution",
          "Charisma"
        ],
        "suggested": {
          "Charisma": 2,
          "Constitution": 1
        }
      },
      "effects": [
        {
          "type": "grant_skill_proficiency",
          "skills": [
            "Persuasion",
            "Stealth"
          ]
        },
        {
          "type": "grant_origin_feat",
          "feat": "Vampire's Plaything"
        },
        {
          "type": "grant_tool_proficiency",
          "tools": [
            "Cook's Utensils"
          ]
        }
      ],
      "starting_equipment": {
        "option_a": {
          "items": [
            "Cook's Utensils",
            "Fine Clothes",
            "Glass Bottle (2)",
            "Healer's Kit",
            "Perfume",
            "Lamp",
            "Oil (3 flasks)",
            "Waterskin"
          ],
          "gold": 19
        },
        "option_b": {
          "gold": 50
        }
      }
    },
    {
      "name": "Vampire Survivor",
      "description": "You witnessed or survived a vampire attack. You might have been directly involved in this confrontation, or perhaps you were frozen in terror by what you saw. Regardless, you remain vigilant for monster attacks and pride yourself on being ready for anything. No vampire will catch you or your allies by surprise again.",
      "edition": "2024",
      "status": "active",
      "source": "Astarion's Book of Hungers",
      "ability_score_increase": {
        "total": 3,
        "options": [
          "Dexterity",
          "Constitution",
          "Wisdom"
        ],
        "suggested": {
          "Dexterity": 2,
          "Wisdom": 1
        }
      },
      "effects": [
        {
          "type": "grant_skill_proficiency",
          "skills": [
            "Insight",
            "Religion"
          ]
        },
        {
          "type": "grant_origin_feat",
          "feat": "Vampire Hunter"
        },
        {
          "type": "grant_tool_proficiency",
          "tools": [
            "Woodcarver's Tools"
          ]
        }
      ],
      "starting_equipment": {
        "option_a": {
          "items": [
            "Woodcarver's Tools",
            "Crowbar",
            "Hooded Lantern",
            "Holy Symbol (reliquary)",
            "Holy Water",
            "Mirror",
            "Oil (3 flasks)",
            "Tinderbox",
            "Traveler's Clothes",
            "Waterskin"
          ],
          "gold": 4
        },
        "option_b": {
          "gold": 50
        }
      }
    }
  ],
  "feats": {
    "origin_feats": {
      "Tireless Reveler": {
        "description": "When an ally you can see within 60 feet of yourself expends Heroic Inspiration, you can gain Heroic Inspiration if you lack it. You can use this benefit a number of times equal to your Proficiency Bonus, and you regain all expended uses when you finish a Short or Long Rest.",
        "benefits": [
          "When an ally you can see within 60 feet of yourself expends Heroic Inspiration, you can gain Heroic Inspiration if you lack it. You can use this benefit a number of times equal to your Proficiency Bonus, and you regain all expended uses when you finish a Short or Long Rest."
        ],
        "category": "Origin",
        "prerequisite": "None",
        "source": "Astarion's Book of Hungers"
      },
      "Vampire Hunter": {
        "description": "You gain the following benefits:",
        "benefits": [
          "Adroit Escape. You have Advantage on checks to escape from nonmagical restraints or the Grappled condition.",
          "Vitality Ward. When you take Necrotic damage, you can take a Reaction to mitigate the damage. Roll a number of d6s equal to your Proficiency Bonus, and add them together. Reduce the Necrotic damage you take by this total. Once you use this benefit, you can't use it again until you finish a Short or Long Rest."
        ],
        "category": "Origin",
        "prerequisite": "None",
        "source": "Astarion's Book of Hungers"
      },
      "Vampire's Plaything": {
        "description": "You gain the following benefits:",
        "benefits": [
          "Decanting. When you finish a Long Rest, you can create one Potion of Healing or an Antitoxin, as long as you have an empty vial or flask. These liquids evaporate when you finish another Long Rest.",
          "Timely Retreat. You can take a Bonus Action to take the Dash action or the Disengage action. You can use this benefit a number of times equal to your Proficiency Bonus, and you recover all expended uses when you finish a Long Rest.",